{
  "quick_reference": {
    "title": "Sterling Bond",
    "logline": "A disgraced operative running a London pawnshop buys an antique watch tied to a cartel account and becomes the next target.",
    "target_market": "EN/US Short-Drama Platform",
    "genre": "Thriller / Action",
    "episode_count": 20,
    "episode_duration_min": "~90s"
  },
  "episode_summaries": [
    {
      "episode_id": "EP01",
      "core_event": "Maya buys a coded watch, refuses to sell it back, and discovers the seller dead with a surveillance photo of herself.",
      "tone": "quiet menace with rising surveillance paranoia",
      "key_reversal": "The danger is already pointed at Maya herself.",
      "closing_hook": "Maya chooses the burner card instead of the police."
    }
  ],
  "scene_index": [
    {
      "scene_id": "S01.01",
      "episode_id": "EP01",
      "time": "Day",
      "location": "INT. STERLING PAWNSHOP - SOHO, LONDON",
      "characters": "MAYA STERLING, PIOTR VENN",
      "core_event": "Piotr sells Maya the pocket watch under visible panic.",
      "start_state": "Maya controls the room; Piotr enters destabilized.",
      "end_state": "Maya secures the watch and knows the engraving matters.",
      "scene_type": "dialogue_driven",
      "screenplay_ref": "S01.01"
    },
    {
      "scene_id": "S01.02",
      "episode_id": "EP01",
      "time": "Day",
      "location": "INT. STERLING PAWNSHOP - FRONT COUNTER",
      "characters": "MAYA STERLING, ELLIOT MARSH",
      "core_event": "Elliot offers to buy the watch back and leaves a warning card.",
      "start_state": "Maya is curious but unafraid; Elliot arrives already informed.",
      "end_state": "Maya now knows the buyer knows her identity and expects escalation.",
      "scene_type": "quick_transition",
      "screenplay_ref": "S01.02"
    }
  ],
  "shot_rows": [
    {
      "shot_id": "01.01.S01",
      "episode_id": "EP01",
      "scene_id": "S01.01",
      "shot_type": "environment_establish",
      "screenplay_ref": "S01.01 OPENING STATE line 1",
      "visual_content": "Dusty front window light cuts across dense silver shelves; UV lamp glows on Maya's counter; register drawer open.",
      "character_action": "Maya stands behind counter sorting rings.",
      "key_info_point": "Establish Maya's domain, lighting logic, and prop layout before conflict enters.",
      "shot_language": "WIDE | EYE-LEVEL | STATIC | shelves deep background, Maya small at counter",
      "dialogue_anchor": "None",
      "emotion": "neutral control",
      "rhythm": "normal",
      "estimated_duration_sec": "4s",
      "transition": "CUT",
      "sfx_music": "ambient shop room tone, faint street hush",
      "continuity_notes": "UV lamp already on; register drawer open; Maya behind counter facing front window.",
      "character_ids": ["CHAR-01"],
      "location_id": "LOC-01",
      "prop_ids": ["PROP-UV-LAMP", "PROP-CASH-REGISTER"],
      "look_ids": ["LOOK-01"],
      "ai_note": "Cold daylight from frame left, dusty diffusion, silver clutter everywhere. Maya in dark cardigan, still posture, minimal motion."
    },
    {
      "shot_id": "01.01.S02",
      "episode_id": "EP01",
      "scene_id": "S01.01",
      "shot_type": "character_enter",
      "screenplay_ref": "S01.01 MAIN BODY block 1",
      "visual_content": "Piotr pushes in, glances back through the glass before stepping fully inside.",
      "character_action": "Piotr enters, checks street, then approaches counter.",
      "key_info_point": "Piotr arrives already afraid of something outside.",
      "shot_language": "MEDIUM | EYE-LEVEL | SLIGHT PUSH IN | door frame isolates Piotr",
      "dialogue_anchor": "None",
      "emotion": "Piotr: fear",
      "rhythm": "normal",
      "estimated_duration_sec": "3s",
      "transition": "CUT",
      "sfx_music": "bell ring at door, street hush dips under",
      "continuity_notes": "Piotr coat on; Maya remains behind counter; front door swings inward then settles.",
      "character_ids": ["CHAR-02"],
      "location_id": "LOC-01",
      "prop_ids": [],
      "look_ids": ["LOOK-02"],
      "ai_note": "Piotr half-backlit from exterior, sweat at hairline, oversized coat. Push in subtle, keep Maya blurred behind him."
    },
    {
      "shot_id": "01.01.S03",
      "episode_id": "EP01",
      "scene_id": "S01.01",
      "shot_type": "hook",
      "screenplay_ref": "S01.01 SCENE ENDING",
      "visual_content": "Alone again, Maya photographs the engraving before locking the watch away.",
      "character_action": "Maya raises phone, takes the photo, then moves toward safe off-frame.",
      "key_info_point": "Maya quietly confirms this object is worth preserving and hiding.",
      "shot_language": "MCU | EYE-LEVEL | STATIC | phone and watch foreground, Maya eye above",
      "dialogue_anchor": "None",
      "emotion": "quiet unease",
      "rhythm": "sustained_pressure",
      "estimated_duration_sec": "4s",
      "transition": "SMASH_CUT",
      "sfx_music": "shutter click isolated, room tone falls away into near-silence",
      "continuity_notes": "Phone screen on camera mode; Maya right hand holds watch, left hand phone; safe action begins after cut.",
      "character_ids": ["CHAR-01"],
      "location_id": "LOC-01",
      "prop_ids": ["PROP-POCKET-WATCH", "PROP-PHONE"],
      "look_ids": ["LOOK-01"],
      "ai_note": "Phone glow reflects off silver case. Maya's eye visible, sharp and unreadable. Hold on the shutter click."
    },
    {
      "shot_id": "01.02.S01",
      "episode_id": "EP01",
      "scene_id": "S01.02",
      "shot_type": "environment_establish",
      "screenplay_ref": "S01.02 OPENING STATE line 1",
      "visual_content": "Laptop open on back counter; velvet pouch beside it; front door opens into otherwise empty shop.",
      "character_action": "Maya stands at back counter as Elliot enters frame.",
      "key_info_point": "Maya is actively researching the engraving when Elliot arrives.",
      "shot_language": "WIDE | EYE-LEVEL | STATIC | laptop and pouch foreground, door rear frame",
      "dialogue_anchor": "None",
      "emotion": "wary quiet",
      "rhythm": "normal",
      "estimated_duration_sec": "3s",
      "transition": "CUT",
      "sfx_music": "room tone, faint laptop fan, door bell",
      "continuity_notes": "Laptop on, search page open; pouch on Maya's right; Maya at back counter; door opens inward.",
      "character_ids": ["CHAR-01", "CHAR-03"],
      "location_id": "LOC-01",
      "prop_ids": ["PROP-LAPTOP", "PROP-WATCH-POUCH"],
      "look_ids": ["LOOK-01", "LOOK-03"],
      "ai_note": "Cool interior, practical screen glow on Maya, Elliot entering from rear with clean silhouette."
    },
    {
      "shot_id": "01.02.S02",
      "episode_id": "EP01",
      "scene_id": "S01.02",
      "shot_type": "hook",
      "screenplay_ref": "S01.02 SCENE ENDING",
      "visual_content": "Maya turns the business card over; handwritten message reads: Don't call the police.",
      "character_action": "Maya flips card with thumb and freezes on the warning.",
      "key_info_point": "The buyer knows the situation is criminal and expects escalation tonight.",
      "shot_language": "INSERT | TOP-DOWN | STATIC | card centered, handwriting sharp",
      "dialogue_anchor": "None",
      "emotion": "dread recognition",
      "rhythm": "pause",
      "estimated_duration_sec": "3s",
      "transition": "HARD_CUT",
      "sfx_music": "room tone drops; paper flick, no score",
      "continuity_notes": "Burner card now in Maya's right hand; laptop remains open; message side visible at shot end.",
      "character_ids": ["CHAR-01"],
      "location_id": "LOC-01",
      "prop_ids": ["PROP-BURNER-CARD", "PROP-LAPTOP"],
      "look_ids": ["LOOK-01"],
      "ai_note": "Tight insert, card centered on dark desk surface, handwriting crisp. Keep Maya's fingers tense at edge of frame."
    }
  ],
  "storyboard_markdown": "# STERLING BOND — English Storyboard Table\\n\\n## EPISODE 01\\n\\n### SCENE 01.01 — Watch Purchase\\n| shot_id | episode_id | scene_id | shot_type | screenplay_ref | visual_content | character_action | key_info_point | shot_language | dialogue_anchor | emotion | rhythm | estimated_duration_sec | transition | sfx_music | continuity_notes | character_ids | location_id | prop_ids | look_ids | ai_note |\\n|---|---|---|---|---|---|---|---|---|---|---|---|---|---|---|---|---|---|---|---|---|\\n| 01.01.S01 | EP01 | S01.01 | environment_establish | S01.01 OPENING STATE line 1 | Dusty front window light cuts across dense silver shelves; UV lamp glows on Maya's counter; register drawer open. | Maya stands behind counter sorting rings. | Establish Maya's domain, lighting logic, and prop layout before conflict enters. | WIDE | None | neutral control | normal | 4s | CUT | ambient shop room tone, faint street hush | UV lamp already on; register drawer open; Maya behind counter facing front window. | [CHAR-01] | LOC-01 | [PROP-UV-LAMP, PROP-CASH-REGISTER] | [LOOK-01] | Cold daylight from frame left, dusty diffusion. |\\n"
}
